{
  "type": "fire_status",
  "version": "0.2",
  "stamp": "2026-10-10T05:12:33.120Z",
  "device_id": "ess_01",
  "level": 1,
  "latched": false,
  "ambient_temp_c": 23.8,
  "ambient_rh_pct": 46.0,
  "surface_max_c": 33.0,
  "surface_mean_c": 24.87,
  "surface_min_c": 24.0,
  "hot_pixels": 1,
  "hotspot_index": 21,
  "delta_c": 6.0,
  "abs_limit_c": 60.0,
  "smoke_v": 0.62,
  "smoke_baseline_v": 0.6,
  "smoke_detected": false,
  "charge_allowed": true,
  "dc_allowed": true,
  "buzzer_on": false,
  "flags": 0,
  "thermal_c": [
    24.0,
    24.0,
    24.01,
    24.16,
    24.74,
    25.22,
    24.74,
    24.16,
    24.0,
    24.0,
    24.06,
    24.74,
    27.31,
    29.46,
    27.31,
    24.74,
    24.0,
    24.0,
    24.1,
    25.22,
    29.46,
    33.0,
    29.46,
    25.22,
    24.0,
    24.0,
    24.06,
    24.74,
    27.31,
    29.46,
    27.31,
    24.74,
    24.0,
    24.0,
    24.01,
    24.16,
    24.74,
    25.22,
    24.74,
    24.16,
    24.0,
    24.0,
    24.0,
    24.01,
    24.06,
    24.1,
    24.06,
    24.01,
    24.0,
    24.0,
    24.0,
    24.0,
    24.0,
    24.0,
    24.0,
    24.0,
    24.0,
    24.0,
    24.0,
    24.0,
    24.0,
    24.0,
    24.0,
    24.0
  ]
}
